{
  "$schema": "https://json-schema.org/draft/2020-12/schema",
  "title": "Evidence Manifest",
  "type": "object",
  "required": ["proof_id", "run_id", "generated_at", "repo_commit", "status", "claims", "diagnostics"],
  "properties": {
    "proof_id": {"type": "string", "minLength": 1},
    "run_id": {"type": "string", "minLength": 1},
    "generated_at": {"type": "string", "minLength": 1},
    "repo_commit": {"type": "string", "minLength": 7},
    "status": {"type": "string", "enum": ["pass", "fail"]},
    "claims": {
      "type": "array",
      "minItems": 1,
      "items": {
        "type": "object",
        "required": ["claim_text", "verification_command", "artifact_paths", "expected_signal"],
        "properties": {
          "claim_text": {"type": "string"},
          "verification_command": {"type": "string"},
          "artifact_paths": {"type": "array", "minItems": 1, "items": {"type": "string"}},
          "expected_signal": {"type": "string"},
          "artifact_sha256": {
            "type": "object",
            "additionalProperties": {
              "type": "string",
              "pattern": "^[a-f0-9]{64}$"
            }
          }
        },
        "additionalProperties": false
      }
    },
    "diagnostics": {"type": "object"}
  },
  "additionalProperties": false
}
